{
  "identifier": "1985_naic_cancer_claim_cost_tables_for_drug_benefits_under_standard_plans_male",
  "version": "unknown",
  "classification": {
    "tableIdentity": "1462",
    "providerDomain": "naic.org",
    "providerName": "NAIC",
    "tableReference": "National Association of Insurance Commissioners, \"1985 NAIC Cancer Claim Cost Tables\", Proceedings of the National Association of Insurance Commissioners, Vol. I. (Kansas City, Mo. 1986)",
    "contentType": {
      "code": "80",
      "label": "Claim Incidence"
    },
    "tableName": "1985 NAIC Cancer Claim Cost Tables for Drug Benefits Under Standard Plans - Male",
    "tableDescription": "1985 National Association of Insurance Commissioners (NAIC) Cancer Claim Cost Tables - Male. Basis: Drug Benefits Under Standard Plans. Minimum Attained Age: 15. Maximum Attained Age: 99",
    "comments": "Study Data: Based on lives insured under cancer expense policies. Claim information includes payments during 1978 and 1979. It is believed 80% of all applicable experience is included in the study. Claim costs that are separated by gender are: hospitalization, surgery, anesthesia, drugs, radiation and chemotherapy, and attending physicians. Claim costs not split by gender are blood and plasma, nursing care and ambulance services. A Standard Plan is defined as having the following: (1) $50 per day for first 7 days then $30 per day, (2) $500 scheduled maximum for surgery, (3) actual expense up to $70 per operation ($30 for skin cancer), (4) 10% of hospital benefit max for medications, (5) actual expense for radiotherapy and chemotherapy with $1,000 lifetime maximum, (6) actual expense up to $300 lifetime maximum for blood and plasma except no maximum for leukemia, (7) private duty nursing care at $24 per hospital day with $600 lifetime maximum, (8) attending physician while in hospital at $10 per day with $600 lifetime maximum, and (9) ambulance services at actual expenses subject to $500 lifetime maximum. Methodology: Tables loaded at a uniform 5% (applied to the incidence rate elements) plus a small amount believed to be 1-2% with regard to the continuance element. Data Transcription Errors: None. Data Certified: 12/2012.",
    "keywords": [
      "Aggregate",
      "Claim Incidence",
      "United States of America"
    ]
  },
  "tables": [
    {
      "index": 0,
      "metadata": {
        "scalingFactor": "0",
        "dataType": {
          "code": "2",
          "label": "Floating Point"
        },
        "nation": {
          "code": "1",
          "label": "United States of America"
        },
        "tableDescription": "1985 National Association of Insurance Commissioners (NAIC) Cancer Claim Cost Tables - Male. Basis: Drug Benefits Under Standard Plans. Minimum Attained Age: 15. Maximum Attained Age: 99",
        "axes": [
          {
            "id": "Age",
            "scaleType": {
              "code": "3",
              "label": "Age"
            },
            "axisName": "Age",
            "minValue": "15",
            "maxValue": "99",
            "increment": "1"
          }
        ]
      },
      "rates": [
        {
          "age": 15,
          "rate": 0.084403
        },
        {
          "age": 16,
          "rate": 0.084403
        },
        {
          "age": 17,
          "rate": 0.084403
        },
        {
          "age": 18,
          "rate": 0.084608
        },
        {
          "age": 19,
          "rate": 0.084811
        },
        {
          "age": 20,
          "rate": 0.084986
        },
        {
          "age": 21,
          "rate": 0.085186
        },
        {
          "age": 22,
          "rate": 0.085436
        },
        {
          "age": 23,
          "rate": 0.085736
        },
        {
          "age": 24,
          "rate": 0.086086
        },
        {
          "age": 25,
          "rate": 0.86214
        },
        {
          "age": 26,
          "rate": 0.086109
        },
        {
          "age": 27,
          "rate": 0.086092
        },
        {
          "age": 28,
          "rate": 0.0861
        },
        {
          "age": 29,
          "rate": 0.082512
        },
        {
          "age": 30,
          "rate": 0.079189
        },
        {
          "age": 31,
          "rate": 0.078068
        },
        {
          "age": 32,
          "rate": 0.081447
        },
        {
          "age": 33,
          "rate": 0.090214
        },
        {
          "age": 34,
          "rate": 0.102918
        },
        {
          "age": 35,
          "rate": 0.118054
        },
        {
          "age": 36,
          "rate": 0.134235
        },
        {
          "age": 37,
          "rate": 0.150537
        },
        {
          "age": 38,
          "rate": 0.165942
        },
        {
          "age": 39,
          "rate": 0.181417
        },
        {
          "age": 40,
          "rate": 0.19824
        },
        {
          "age": 41,
          "rate": 0.216385
        },
        {
          "age": 42,
          "rate": 0.2391
        },
        {
          "age": 43,
          "rate": 0.266213
        },
        {
          "age": 44,
          "rate": 0.29595
        },
        {
          "age": 45,
          "rate": 0.328425
        },
        {
          "age": 46,
          "rate": 0.36415
        },
        {
          "age": 47,
          "rate": 0.403375
        },
        {
          "age": 48,
          "rate": 0.444675
        },
        {
          "age": 49,
          "rate": 0.487875
        },
        {
          "age": 50,
          "rate": 0.535075
        },
        {
          "age": 51,
          "rate": 0.5886
        },
        {
          "age": 52,
          "rate": 0.650625
        },
        {
          "age": 53,
          "rate": 0.72275
        },
        {
          "age": 54,
          "rate": 0.80355
        },
        {
          "age": 55,
          "rate": 0.89055
        },
        {
          "age": 56,
          "rate": 0.9813
        },
        {
          "age": 57,
          "rate": 1.07333
        },
        {
          "age": 58,
          "rate": 1.16628
        },
        {
          "age": 59,
          "rate": 1.2617
        },
        {
          "age": 60,
          "rate": 1.36035
        },
        {
          "age": 61,
          "rate": 1.46278
        },
        {
          "age": 62,
          "rate": 1.56933
        },
        {
          "age": 63,
          "rate": 1.68398
        },
        {
          "age": 64,
          "rate": 1.80615
        },
        {
          "age": 65,
          "rate": 1.93045
        },
        {
          "age": 66,
          "rate": 2.05118
        },
        {
          "age": 67,
          "rate": 2.16278
        },
        {
          "age": 68,
          "rate": 2.26663
        },
        {
          "age": 69,
          "rate": 2.36648
        },
        {
          "age": 70,
          "rate": 2.46028
        },
        {
          "age": 71,
          "rate": 2.54585
        },
        {
          "age": 72,
          "rate": 2.6213
        },
        {
          "age": 73,
          "rate": 2.68368
        },
        {
          "age": 74,
          "rate": 2.73433
        },
        {
          "age": 75,
          "rate": 2.77765
        },
        {
          "age": 76,
          "rate": 2.81783
        },
        {
          "age": 77,
          "rate": 2.85925
        },
        {
          "age": 78,
          "rate": 2.90593
        },
        {
          "age": 79,
          "rate": 2.9549
        },
        {
          "age": 80,
          "rate": 3.0002
        },
        {
          "age": 81,
          "rate": 3.03588
        },
        {
          "age": 82,
          "rate": 3.0559
        },
        {
          "age": 83,
          "rate": 3.05763
        },
        {
          "age": 84,
          "rate": 3.04493
        },
        {
          "age": 85,
          "rate": 3.02198
        },
        {
          "age": 86,
          "rate": 2.99283
        },
        {
          "age": 87,
          "rate": 2.96147
        },
        {
          "age": 88,
          "rate": 2.92613
        },
        {
          "age": 89,
          "rate": 2.8842
        },
        {
          "age": 90,
          "rate": 2.8383
        },
        {
          "age": 91,
          "rate": 2.7909
        },
        {
          "age": 92,
          "rate": 2.74488
        },
        {
          "age": 93,
          "rate": 2.6982
        },
        {
          "age": 94,
          "rate": 2.64933
        },
        {
          "age": 95,
          "rate": 2.60088
        },
        {
          "age": 96,
          "rate": 2.55533
        },
        {
          "age": 97,
          "rate": 2.47085
        },
        {
          "age": 98,
          "rate": 2.47085
        },
        {
          "age": 99,
          "rate": 2.47085
        }
      ]
    }
  ]
}
