{
  "identifier": "pubg_2010_male_retiree",
  "version": "unknown",
  "classification": {
    "tableIdentity": "3400",
    "providerDomain": "soa.org",
    "providerName": "Retirement Plans Experience Committee",
    "tableReference": "Society of Actuaries, public-pension-amount-exposure.xlsx, Sheet 'PubG-2010', https://www.soa.org/resources/experience-studies/2018/public-pension-amount-exposure.xlsx",
    "contentType": {
      "code": "78",
      "label": "Annuitant Mortality"
    },
    "tableName": "PubG-2010 Male Retiree",
    "tableDescription": "Pub-2010 Amount-weighted General Mortality Table - Male Retiree. Ages 50-120. Base Year July 1, 2010 - June 30, 2011.",
    "comments": "Study Data: The primary focus of this study was a comprehensive review of recent mortality experience of public retirement plans in the United States. The final dataset upon which this study has been based includes approximately 46 million life-years of exposure and 580 thousand deaths from public pension systems across the United States. Data certified: 09/2018.",
    "keywords": [
      "Aggregate",
      "Annuitant Mortality",
      "United States of America"
    ]
  },
  "tables": [
    {
      "index": 0,
      "metadata": {
        "scalingFactor": "0",
        "dataType": {
          "code": "2",
          "label": "Floating Point"
        },
        "nation": {
          "code": "1",
          "label": "United States of America"
        },
        "tableDescription": "Pub-2010 Amount-weighted General Mortality Table - Male Retiree. Ages 50-120. Base Year July 1, 2010 - June 30, 2011.",
        "axes": [
          {
            "id": "Age",
            "scaleType": {
              "code": "3",
              "label": "Age"
            },
            "axisName": "Age",
            "minValue": "50",
            "maxValue": "120",
            "increment": "1"
          }
        ]
      },
      "rates": [
        {
          "age": 50,
          "rate": 0.00298
        },
        {
          "age": 51,
          "rate": 0.00321
        },
        {
          "age": 52,
          "rate": 0.00346
        },
        {
          "age": 53,
          "rate": 0.00372
        },
        {
          "age": 54,
          "rate": 0.00401
        },
        {
          "age": 55,
          "rate": 0.00431
        },
        {
          "age": 56,
          "rate": 0.00463
        },
        {
          "age": 57,
          "rate": 0.00497
        },
        {
          "age": 58,
          "rate": 0.00533
        },
        {
          "age": 59,
          "rate": 0.00573
        },
        {
          "age": 60,
          "rate": 0.00615
        },
        {
          "age": 61,
          "rate": 0.00661
        },
        {
          "age": 62,
          "rate": 0.00713
        },
        {
          "age": 63,
          "rate": 0.0077
        },
        {
          "age": 64,
          "rate": 0.00836
        },
        {
          "age": 65,
          "rate": 0.00913
        },
        {
          "age": 66,
          "rate": 0.01003
        },
        {
          "age": 67,
          "rate": 0.01108
        },
        {
          "age": 68,
          "rate": 0.01229
        },
        {
          "age": 69,
          "rate": 0.01368
        },
        {
          "age": 70,
          "rate": 0.01526
        },
        {
          "age": 71,
          "rate": 0.01703
        },
        {
          "age": 72,
          "rate": 0.01904
        },
        {
          "age": 73,
          "rate": 0.02129
        },
        {
          "age": 74,
          "rate": 0.02384
        },
        {
          "age": 75,
          "rate": 0.02671
        },
        {
          "age": 76,
          "rate": 0.02995
        },
        {
          "age": 77,
          "rate": 0.03361
        },
        {
          "age": 78,
          "rate": 0.03775
        },
        {
          "age": 79,
          "rate": 0.04243
        },
        {
          "age": 80,
          "rate": 0.04774
        },
        {
          "age": 81,
          "rate": 0.05374
        },
        {
          "age": 82,
          "rate": 0.06052
        },
        {
          "age": 83,
          "rate": 0.06811
        },
        {
          "age": 84,
          "rate": 0.07656
        },
        {
          "age": 85,
          "rate": 0.08591
        },
        {
          "age": 86,
          "rate": 0.09615
        },
        {
          "age": 87,
          "rate": 0.10733
        },
        {
          "age": 88,
          "rate": 0.11947
        },
        {
          "age": 89,
          "rate": 0.1326
        },
        {
          "age": 90,
          "rate": 0.14672
        },
        {
          "age": 91,
          "rate": 0.1617
        },
        {
          "age": 92,
          "rate": 0.17745
        },
        {
          "age": 93,
          "rate": 0.19392
        },
        {
          "age": 94,
          "rate": 0.21107
        },
        {
          "age": 95,
          "rate": 0.22888
        },
        {
          "age": 96,
          "rate": 0.24731
        },
        {
          "age": 97,
          "rate": 0.26634
        },
        {
          "age": 98,
          "rate": 0.28589
        },
        {
          "age": 99,
          "rate": 0.30586
        },
        {
          "age": 100,
          "rate": 0.32609
        },
        {
          "age": 101,
          "rate": 0.34636
        },
        {
          "age": 102,
          "rate": 0.3664
        },
        {
          "age": 103,
          "rate": 0.38604
        },
        {
          "age": 104,
          "rate": 0.40512
        },
        {
          "age": 105,
          "rate": 0.42352
        },
        {
          "age": 106,
          "rate": 0.44113
        },
        {
          "age": 107,
          "rate": 0.45786
        },
        {
          "age": 108,
          "rate": 0.47364
        },
        {
          "age": 109,
          "rate": 0.48843
        },
        {
          "age": 110,
          "rate": 0.5
        },
        {
          "age": 111,
          "rate": 0.5
        },
        {
          "age": 112,
          "rate": 0.5
        },
        {
          "age": 113,
          "rate": 0.5
        },
        {
          "age": 114,
          "rate": 0.5
        },
        {
          "age": 115,
          "rate": 0.5
        },
        {
          "age": 116,
          "rate": 0.5
        },
        {
          "age": 117,
          "rate": 0.5
        },
        {
          "age": 118,
          "rate": 0.5
        },
        {
          "age": 119,
          "rate": 0.5
        },
        {
          "age": 120,
          "rate": 1
        }
      ]
    }
  ]
}
