{
  "identifier": "pri_2012_female_retiree_white_collar",
  "version": "unknown",
  "classification": {
    "tableIdentity": "3555",
    "providerDomain": "soa.org",
    "providerName": "Retirement Plans Experience Committee",
    "tableReference": "Society of Actuaries, pri-2012-mort-tables-amount.xlsx, Sheet 'White Collar', https://www.soa.org/globalassets/assets/files/resources/experience-studies/2019/pri-2012-mort-tables-amount.xlsx",
    "contentType": {
      "code": "78",
      "label": "Annuitant Mortality"
    },
    "tableName": "Pri-2012 Female Retiree White Collar",
    "tableDescription": "Pri-2012 Amount-weighted Mortality Table - Female Retiree White Collar. Ages 50-120. Base Year January 1, 2012 - December 31, 2012.",
    "comments": "Study Data: The primary focus of this study was a comprehensive review of recent mortality experience of private-sector retirement plans in the United States. The final dataset upon which this study has been based includes approximately 16 million life-years of exposure and 343 thousand deaths from private pension plans across the United States.  Data certified: 05/2019.",
    "keywords": [
      "Aggregate",
      "Annuitant Mortality",
      "United States of America"
    ]
  },
  "tables": [
    {
      "index": 0,
      "metadata": {
        "scalingFactor": "0",
        "dataType": {
          "code": "2",
          "label": "Floating Point"
        },
        "nation": {
          "code": "1",
          "label": "United States of America"
        },
        "tableDescription": "Pri-2012 Amount-weighted Mortality Table - Female Retiree White Collar. Ages 50-120. Base Year January 1, 2012 - December 31, 2012.",
        "axes": [
          {
            "id": "Age",
            "scaleType": {
              "code": "3",
              "label": "Age"
            },
            "axisName": "Age",
            "minValue": "50",
            "maxValue": "120",
            "increment": "1"
          }
        ]
      },
      "rates": [
        {
          "age": 50,
          "rate": 0.00224
        },
        {
          "age": 51,
          "rate": 0.00241
        },
        {
          "age": 52,
          "rate": 0.0026
        },
        {
          "age": 53,
          "rate": 0.0028
        },
        {
          "age": 54,
          "rate": 0.00302
        },
        {
          "age": 55,
          "rate": 0.00325
        },
        {
          "age": 56,
          "rate": 0.00351
        },
        {
          "age": 57,
          "rate": 0.00378
        },
        {
          "age": 58,
          "rate": 0.00408
        },
        {
          "age": 59,
          "rate": 0.0044
        },
        {
          "age": 60,
          "rate": 0.00474
        },
        {
          "age": 61,
          "rate": 0.00518
        },
        {
          "age": 62,
          "rate": 0.00567
        },
        {
          "age": 63,
          "rate": 0.00619
        },
        {
          "age": 64,
          "rate": 0.00677
        },
        {
          "age": 65,
          "rate": 0.0074
        },
        {
          "age": 66,
          "rate": 0.00809
        },
        {
          "age": 67,
          "rate": 0.00885
        },
        {
          "age": 68,
          "rate": 0.0097
        },
        {
          "age": 69,
          "rate": 0.01064
        },
        {
          "age": 70,
          "rate": 0.0117
        },
        {
          "age": 71,
          "rate": 0.0129
        },
        {
          "age": 72,
          "rate": 0.01425
        },
        {
          "age": 73,
          "rate": 0.0158
        },
        {
          "age": 74,
          "rate": 0.01756
        },
        {
          "age": 75,
          "rate": 0.01958
        },
        {
          "age": 76,
          "rate": 0.02189
        },
        {
          "age": 77,
          "rate": 0.02452
        },
        {
          "age": 78,
          "rate": 0.02754
        },
        {
          "age": 79,
          "rate": 0.03099
        },
        {
          "age": 80,
          "rate": 0.03492
        },
        {
          "age": 81,
          "rate": 0.03941
        },
        {
          "age": 82,
          "rate": 0.04451
        },
        {
          "age": 83,
          "rate": 0.05029
        },
        {
          "age": 84,
          "rate": 0.05682
        },
        {
          "age": 85,
          "rate": 0.06419
        },
        {
          "age": 86,
          "rate": 0.0725
        },
        {
          "age": 87,
          "rate": 0.08185
        },
        {
          "age": 88,
          "rate": 0.0924
        },
        {
          "age": 89,
          "rate": 0.10428
        },
        {
          "age": 90,
          "rate": 0.11771
        },
        {
          "age": 91,
          "rate": 0.13223
        },
        {
          "age": 92,
          "rate": 0.14748
        },
        {
          "age": 93,
          "rate": 0.16264
        },
        {
          "age": 94,
          "rate": 0.17864
        },
        {
          "age": 95,
          "rate": 0.19539
        },
        {
          "age": 96,
          "rate": 0.21279
        },
        {
          "age": 97,
          "rate": 0.23075
        },
        {
          "age": 98,
          "rate": 0.24917
        },
        {
          "age": 99,
          "rate": 0.26794
        },
        {
          "age": 100,
          "rate": 0.28698
        },
        {
          "age": 101,
          "rate": 0.30619
        },
        {
          "age": 102,
          "rate": 0.32549
        },
        {
          "age": 103,
          "rate": 0.34472
        },
        {
          "age": 104,
          "rate": 0.36375
        },
        {
          "age": 105,
          "rate": 0.38243
        },
        {
          "age": 106,
          "rate": 0.40065
        },
        {
          "age": 107,
          "rate": 0.41828
        },
        {
          "age": 108,
          "rate": 0.43522
        },
        {
          "age": 109,
          "rate": 0.45139
        },
        {
          "age": 110,
          "rate": 0.46673
        },
        {
          "age": 111,
          "rate": 0.4812
        },
        {
          "age": 112,
          "rate": 0.49477
        },
        {
          "age": 113,
          "rate": 0.5
        },
        {
          "age": 114,
          "rate": 0.5
        },
        {
          "age": 115,
          "rate": 0.5
        },
        {
          "age": 116,
          "rate": 0.5
        },
        {
          "age": 117,
          "rate": 0.5
        },
        {
          "age": 118,
          "rate": 0.5
        },
        {
          "age": 119,
          "rate": 0.5
        },
        {
          "age": 120,
          "rate": 1
        }
      ]
    }
  ]
}
